{
  "$schema": "https://json-schema.org/draft/2020-12/schema",
  "$id": "https://github.com/tjsasakifln/Governance/schemas/net-new-inbound-handraiser-request.v1.schema.json",
  "title": "NET_NEW_INBOUND_HANDRAISER request v1",
  "type": "object",
  "additionalProperties": false,
  "required": [
    "schema_version",
    "origin",
    "acquisition_lane",
    "intent_kind",
    "idempotency_key",
    "correlation_id",
    "receipt_id",
    "contact_evidence",
    "consent_evidence"
  ],
  "properties": {
    "schema_version": { "const": "net-new-inbound-handraiser-request.v1" },
    "origin": { "type": "string", "minLength": 1 },
    "acquisition_lane": { "type": "string", "minLength": 1 },
    "intent_kind": { "type": "string", "minLength": 1 },
    "idempotency_key": { "type": "string", "minLength": 1 },
    "correlation_id": { "type": "string", "minLength": 1 },
    "receipt_id": { "type": "string", "minLength": 1 },
    "subject_ref": { "type": ["string", "null"] },
    "account_ref": { "type": ["string", "null"] },
    "opt_out": { "type": "boolean" },
    "contact_evidence": { "$ref": "#/$defs/contact_evidence" },
    "consent_evidence": { "$ref": "#/$defs/consent_evidence" },
    "source": { "$ref": "#/$defs/source" },
    "freshness": { "$ref": "#/$defs/freshness" },
    "policy_id": { "type": "string", "minLength": 1 },
    "policy_version": { "type": "string", "minLength": 1 },
    "canonical_name": { "type": "string", "minLength": 1 }
  },
  "$defs": {
    "contact_evidence": {
      "type": "object",
      "additionalProperties": false,
      "required": ["present", "channel", "evidence_ref", "identity_match_method"],
      "properties": {
        "present": { "type": "boolean" },
        "channel": { "type": "string", "minLength": 1 },
        "evidence_ref": { "type": "string", "minLength": 1 },
        "identity_match_method": { "type": "string", "minLength": 1 }
      }
    },
    "consent_evidence": {
      "type": "object",
      "additionalProperties": false,
      "required": ["captured", "basis", "evidence_ref"],
      "properties": {
        "captured": { "type": "boolean" },
        "basis": { "type": "string", "minLength": 1 },
        "evidence_ref": { "type": "string", "minLength": 1 }
      }
    },
    "source": {
      "type": "object",
      "additionalProperties": false,
      "required": ["system"],
      "properties": {
        "system": { "type": "string", "minLength": 1 },
        "issue_ref": { "type": "string", "minLength": 1 }
      }
    },
    "freshness": {
      "type": "object",
      "additionalProperties": false,
      "required": ["as_of", "max_age_seconds"],
      "properties": {
        "as_of": {
          "type": "string",
          "pattern": "^[0-9]{4}-[0-9]{2}-[0-9]{2}T[0-9]{2}:[0-9]{2}:[0-9]{2}Z$"
        },
        "max_age_seconds": { "type": "integer", "minimum": 1 }
      }
    }
  }
}
