{
  "schema_version": "net-new-inbound-handraiser-request.v1",
  "origin": "CONFENGE_WEB",
  "acquisition_lane": "NET_NEW_INBOUND",
  "intent_kind": "HUMAN_REVIEW",
  "idempotency_key": "nihr:web:unknown-contact-001",
  "correlation_id": "corr_unknown_contact_001",
  "receipt_id": "rcpt_unknown_contact_001",
  "subject_ref": null,
  "account_ref": null,
  "contact_evidence": {
    "present": false,
    "channel": "EMAIL",
    "evidence_ref": "ev_contact_missing_001",
    "identity_match_method": "EXPLICIT_CONTACT"
  },
  "consent_evidence": {
    "captured": true,
    "basis": "EXPLICIT_FORM_SUBMIT",
    "evidence_ref": "ev_consent_missing_contact_001"
  },
  "policy_id": "NET_NEW_INBOUND_HANDRAISER",
  "policy_version": "v1",
  "canonical_name": "NET_NEW_INBOUND_HANDRAISER-v1"
}
