{
  "schema_version": "net-new-inbound-handraiser-request.v1",
  "policy_id": "NET_NEW_INBOUND_HANDRAISER",
  "policy_version": "v1",
  "canonical_name": "NET_NEW_INBOUND_HANDRAISER-v1",
  "origin": "intel_watch",
  "acquisition_lane": "NET_NEW_INBOUND",
  "intent_kind": "REQUEST_HUMAN_REVIEW",
  "idempotency_key": "inbound_only:intel_watch:REQUEST_HUMAN_REVIEW:fixture-contact",
  "correlation_id": "corr_extra_cli_intel_001",
  "receipt_id": "rcpt_extra_cli_intel_001",
  "subject_ref": null,
  "account_ref": null,
  "contact_evidence": {
    "present": true,
    "channel": "EMAIL",
    "evidence_ref": "ev_contact_extra_cli_001",
    "identity_match_method": "EXPLICIT_CONTACT"
  },
  "consent_evidence": {
    "captured": true,
    "basis": "EXPLICIT_FORM_SUBMIT",
    "evidence_ref": "ev_consent_extra_cli_001"
  },
  "source": {
    "system": "extra-cli",
    "issue_ref": "tjsasakifln/extra-cli#530"
  },
  "freshness": {
    "as_of": "2026-09-03T11:00:00Z",
    "max_age_seconds": 86400
  }
}
